{
  "$schema": "https://json-schema.org/draft/2020-12/schema",
  "$id": "https://zurvival.example/schemas/npc.schema.json",
  "title": "Survivor NPC",
  "description": "A handcrafted, named survivor (FR-NPC-01). Static definition only; per-run state (needs, location, alive, trust) lives in GameState.npcs, seeded at spawn (T33). `disposition` sets the survivor's starting trust toward the player (T34). background/personality/secret are the character flavour surfaced later (T35+).",
  "type": "object",
  "required": ["id", "name", "description", "disposition"],
  "additionalProperties": false,
  "properties": {
    "$schema": { "type": "string", "description": "Optional editor hint pointing at this schema." },
    "id": { "type": "string", "pattern": "^npc\\.[a-z0-9]+(?:[-_][a-z0-9]+)*$", "description": "Stable content id of the form npc.<slug>." },
    "name": { "type": "string", "minLength": 1, "description": "Player-facing name (ICU MessageFormat string)." },
    "description": { "type": "string", "minLength": 1, "description": "How the survivor reads on first meeting (ICU MessageFormat string)." },
    "disposition": { "enum": ["hostile", "wary", "neutral", "friendly", "desperate"], "description": "Baseline temperament; seeds starting trust (T34)." },
    "homeNode": { "type": "string", "pattern": "^node\\.[a-z0-9]+(?:[.\\-_][a-z0-9]+)*$", "description": "Preferred starting node id; when absent the `npc` RNG stream picks one (T33)." },
    "background": { "type": "string", "description": "One-line history — who they were before (FR-NPC-01)." },
    "personality": { "type": "string", "description": "One-line personality note (FR-NPC-01)." },
    "secret": { "type": "string", "description": "Something they are not telling you yet (FR-NPC-01; surfaced via T35+)." },
    "notes": { "type": "string", "description": "Author commentary (JSON has no comments, ADR-0002)." }
  }
}
